{
  "schema_version": "human_review_consensus_export_v1",
  "description": "Small synthetic consensus-label export examples for conservative review handoffs.",
  "disclaimer": "Consensus exports are conservative review handoff summaries only; they are not discovery claims, detections, or external validation.",
  "exports": [
    {
      "candidate_id": "example-radio-clean",
      "track": "radio",
      "consensus_label": "no_consensus",
      "export_path": "examples/exports/consensus/example-radio-clean.consensus.json",
      "evidence_summary": "Synthetic radio review example retained as no-consensus pending additional review.",
      "negative_evidence_count": 2,
      "blocking_issue_count": 0,
      "reviewer_decision_count": 3
    },
    {
      "candidate_id": "cal-radio-rfi",
      "track": "radio",
      "consensus_label": "likely_false_positive",
      "export_path": "examples/exports/consensus/cal-radio-rfi.consensus.json",
      "evidence_summary": "Synthetic RFI calibration case retained as a likely false positive for review workflow tests.",
      "negative_evidence_count": 4,
      "blocking_issue_count": 1,
      "reviewer_decision_count": 3
    },
    {
      "candidate_id": "example-infrared-clean",
      "track": "infrared",
      "consensus_label": "follow_up_target",
      "export_path": "examples/exports/consensus/example-infrared-clean.consensus.json",
      "evidence_summary": "Synthetic infrared review example exercises follow-up target routing without implying confirmation.",
      "negative_evidence_count": 2,
      "blocking_issue_count": 0,
      "reviewer_decision_count": 3
    },
    {
      "candidate_id": "known-object-demo",
      "track": "anomaly",
      "consensus_label": "known_object_annotation",
      "export_path": "examples/exports/consensus/known-object-demo.consensus.json",
      "evidence_summary": "Synthetic known-object style example remains annotation-only.",
      "negative_evidence_count": 3,
      "blocking_issue_count": 0,
      "reviewer_decision_count": 2
    },
    {
      "candidate_id": "low-confidence-demo",
      "track": "anomaly",
      "consensus_label": "insufficient_evidence",
      "export_path": "examples/exports/consensus/low-confidence-demo.consensus.json",
      "evidence_summary": "Synthetic low-confidence example preserves blocking issues and insufficient evidence.",
      "negative_evidence_count": 5,
      "blocking_issue_count": 2,
      "reviewer_decision_count": 2
    }
  ]
}
